{
    "id": "native.code.enhanced",
    "family": "requirement",
    "category": "technical_content",
    "lifecycle": "framework_gap",
    "authoring": {
        "syntax": "unavailable",
        "call": null,
        "jobs": [
            "enhance_code"
        ],
        "parameters": []
    },
    "states": [],
    "verification": {
        "renderer": false,
        "tests": false,
        "docs": false,
        "demo": false
    },
    "docs_ref": "docs/site/content/ru/start/component-model.md",
    "provenance": {
        "source_kind": "product_requirement",
        "framework_owner": "simai/docara"
    },
    "gap": {
        "owner": "simai/docara",
        "reason": "Code blocks have no file title, line highlighting, line numbers, diff markers, focus or terminal frame yet.",
        "fallback": "Use a plain fenced code block, or :::code {src=... lines=...} to show a project file or a line range.",
        "admission": "Docara renders these options at build time for fenced blocks and :::code alike, with tests, a docs page with a live example and a catalogue entry; this record is then removed."
    }
}
